category,movie,title,rating,genre,subgenre,theme,keyword,releasedate,country,review
Action,Sholay,Sholay (1975),8,Action,Adventure Drama,Tough Guys,"revenge, mutilation, redemption, family-member, killing, police, robbery",,India,"This 1975 film provides a superb look at popular Hindi cinema. Although it can be called an adventure, it has a spaghetti-western storyline, martial-arts sequences, comedy, soap-opera melodrama, and even musical numbers, including an early scene that has the two main characters riding a motorcycle and singing like Elvis Presley in the carnival flick, Roustabout. The film itself is indeed a carnival, and many of the features produced by India's popular movie industry exhibit a similar mixture of ingredients in an attempt to meet the audience's every possible expectation. Veeru (Dharmendra) and Jaidev (Amitabh Bachchan) are two small-time troublemakers who, in the past, have run afoul of Thakur Baldev Singh (Sanjeev Kumar); the Thakur, a former law officer, has seen the pair's heroic nature despite their criminal ways. When a gang of bandits led by Gabbar Singh (Amjad Khan) murders the Thakur's family and cuts off his arms, rendering him helpless rather than killing him, he enlists Veeru and Jaidev to help him seek revenge. In the Thakur's rural village, the two bandits find romance and a hope for redemption and seek to free the village from Gabbar and his minions. The massive appeal in India of films like Sholay becomes evident; surprisingly, it succeeds in almost every genre it attempts to play."
Action,The Gun Hawk,The Gun Hawk (1963),8,Action,,,"gunfighter, aging, gun, shoot-out, outlaw [Western], protegé, wound [injury], bad-guy-turns-good, death, dignity",28-Aug-63,USA,"Allied Artists' Gun Hawk puts Rory Calhoun through his usual paces as an aging gunman. Calhoun has pretty much retired from shoot outs, and now runs a small town populated by outlaws. He befriends hotheaded fast gun Rod Lauren, who behaves as impulsively as Calhoun had in his earlier days. When the outlaws turn on Calhoun and shoot him down, the mortally wounded gunslinger tries to goad Lauren into a fight so that he can die with a modicum of dignity. Producer Richard Bernstein co-wrote the screenplay of Gun Hawk from his own story."
Action,Blue Gender: The Warrior,Blue Gender: The Warrior (2004),8,Action,Anime,"Time Sleepers,Task Forces,Mecha [Anime],Future Dystopias,Evil Aliens,Chosen One","man-vs-aliens, soldier, incurable, savior, cryogenics, suspended-animation",,Japan,"This re-edit of the TV series Blue Gender cuts together key scenes to form a shorter version of the same storyline. Yuji awakens from a cryogenic sleep with memories of being put into suspended animation because he had an incurable disease. The world he awakens to, however, is overrun by a malicious, plant-like alien species called the Blue. He wants no part in the violence and death that now surrounds him but a group of soldiers fighting the Blue in the hope of reclaiming the Earth takes him into their ranks. The oddity in his body that once rendered him terminally ill might just make him the savior of all man kind-but will he survive to enjoy it?"
Action,Son of the Border,Son of the Border (1933),8,Action,,Faltering Friendships,"son, lawman, adoption, stagecoach, death, gold, killing, outlaw [Western], cowboy, friendship",,USA,"This Tom Keene western casts the leading man as a lawkeeper who accidentally kills his best friend (Creighton Chaney, aka Lon Chaney Jr.) when the latter becomes involved with an outlaw gang. Tom adopts his dead pal's son (David Durand), raising him as his own. The one startling aspect of the narrative is that the bandits are not treated as out-and-out villains, but as coolheaded journeyman laborers who happen to be on the wrong side of the law. Julie Haydon, who later originated the stage role of Laura in The Glass Menagerie, is Keene's leading lady. Unlike many of Tom Keene's RKO westerns, this is set in the 19th rather than the 20th century."
Action,Operation Crossbow,Operation Crossbow (1965),8,Action,War Adventure,Tough Guys,"espionage, mission [quest], sabotage, spy, war",1-Mar-65,"Italy, UK, USA","This big-budget, big-studio espionage film is set in the last years of World War II. George Peppard, Tom Courtenay and Jeremy Kemp parachute into Germany, with orders to destroy the Nazis' rocket base at Peenemunde. Featuring Sophia Loren as the wife of the Nazi collaborator whom Peppard is pretending to be, Operation Crossbow failed badly in its first release; MGM, deciding that the title misled moviegoers into thinking that the picture was a ""Robin Hood"" derivation, cleared up matters by renaming the film The Great Spy Mission."
Action,The Green Hornet [Serial],The Green Hornet [Serial] (1940),8,Action,Superhero Film,"Members of the Press,Assumed Identities","crimefighter, newspaper, outlaw [Western], publisher, secret-identity, valet [servant], chase",,USA,"The 13-episode Universal serial The Green Hornet is based on the radio series of the same name. Gordon Jones stars as Britt Reid, crusading young publisher of the Daily Sentinel, who matches wits with the underworld by disguising himself as the Green Hornet. So far as police are concerned, the Hornet is himself a criminal; this misunderstanding enables Reid to operate ""outside the law"" to battle criminals and racketeers. In the course of the serial, Reid and his faithful valet Kato (Keye Luke), the only living person who knows the true identity of the Hornet, take on a crooked insurance racket, an auto-theft ring and a dishonest flying school. Others in the cast include Anne Nagel as Reid's secretary Lenore ""Casey"" Case, and Wade Boteler as thick-headed detective Michael Axford. A TV version of The Green Hornet appeared in 1966, with Van Williams as Reid and no less than Bruce Lee as Kato."
Action,Hell's Angels on Wheels,Hell's Angels on Wheels (1967),8,Action,Biker Film,"Dangerous Friends,Bohemian Life","Hell's-Angels, biker, motorcycle, on-the-road, cross-country, gas-station, harassment, love-triangle, rampage, revenge",1-Dec-67,USA,"A bunch of hairy guys on Harleys are causing trouble again in this, one of the best-remembered examples of the biker flicks of the 1960's. Poet (Jack Nicholson) is a moody gas station attendant who is looking for more excitement in his life. When a gang of bikers roars through town, Poet is intrigued, and after he pitches in to help the Hell's Angels in a bar fight (and pulls a well-timed stick up), one of the gang's higher-ups, Buddy (Adam Roarke) asks Poet to join. Soon Poet is riding with the Angels and living their lifestyle of violent debauchery, but Poet begins to tire of their rootless decadence, and Buddy is none too happy with Poet when he learns they're both in love with the same woman. Hell's Angels On Wheels won a cult following for its agressive but languid atmosphere and the fluid camerawork of cinematographer Laszlo Kovacs (at this point still billed as ""Leslie Kovacs""). Richard Rush directed, and legendary Hell's Angels leader Sonny Barger appears as himself."
Action,The Guardians,The Guardians (2017),8,Action,Sci-Fi Action,Adrenaline Rush,"Russia, secret-organization, Superhero",4-May-18,Russia,"Set in the heart of the Cold War, a secret superhero organization that recruited the best of the best from various Soviet Republics must reveal itself for the good of the nation as an unstoppable supervillain bears down on Moscow. Directed by Sarik Andreasyan."
Action,A Hard Day,A Hard Day (2014),8,Action,Action Thriller,Adrenaline Rush,"detective, embezzlement, funeral, hit-and-run, investigation, mother",,South Korea,"For Detective Go Geon-soo (Sun-kyun Lee), the past 24 hours has been a nightmare from which he cannot awaken. His wife leaves him, his mother dies suddenly and he is under investigation for embezzlement. Things get much worse when Geon-soo commits a fatal hit-and-run on the way to his mother's funeral. After successfully hiding the dead man's corpse he is contacted by someone claiming to have witnessed the whole thing and is now threatening his life. Directed by Seong-hoon Kim."
Action,Drunken Master,Drunken Master (1978),8,Action,Martial Arts,"Just for Fun,Adrenaline Rush","drunk, fight, uncle, Kung-Fu, martial-arts, master [expert], bad-guy, good-guy",,Hong Kong,"One of the earliest major films starring Jackie Chan, this 1978 Hong Kong offering highlights the relationship between a student and his martial arts master. This theme would dominate the American martial arts genre for years to come, as evidenced by The Karate Kid and many films to follow. Wong Fei-hong, played by Chan, is a 19th-century folk hero in Chinese culture and cinema, a kung fu master who fights injustice in the time of British colonialism. This character would later be portrayed by Jet Li in the more serious Once Upon a Time in China. Drunken Master finds Wong in his early years as a troublesome youth who is sent to receive discipline and martial arts instruction from his uncle (Siu Tien Yuen), the hard-drinking title character. Wong runs away, but runs afoul of some local villains. Beaten badly, he returns to his uncle, who trains him in ""drunken-style"" kung fu. The martial arts showcased by Chan in this film are important in the development of his career; the staggering, inebriated techniques allow for a looser, more flowing style, but more importantly, they contribute to the elaborate martial-arts slapstick that have become Chan's trademark and have made him an international star."
Action,You Only Live Twice,You Only Live Twice (1967),8,Action,Glamorized Spy Film,Adrenaline Rush,"British, deception, espionage, hero, nemesis, terrorism, villain, world-domination, volcano",,UK,"James Bond heads East to save the world (and to learn how to serve saki properly) in this action-packed espionage adventure. When an American spacecraft disappears during a mission, it's widely believed to have been intercepted by the Soviet Union, and after a Russian space capsule similarly goes missing, most consider it to be an act of American retaliation. Soon the two nations are at the brink of war, but British intelligence discovers that some sort of UFO has crashed into the Sea of Japan. Agent 007, James Bond (Sean Connery) is sent in to investigate. After staging his own death to avoid being followed, Bond, disguised as a Japanese civilian, teams up with agent Tiger Tanaka (Tetsuro Tamba) and his beautiful associate Aki (Akiko Wakabayashi). With their help, Bond learns that both the American and Russian space missions were actually scuttled by supercriminal Ernst Blofeld (Donald Pleasance) in yet another bid by his evil empire SPECTRE to take over the world. As he battles the bad guys, Bond finds time to romance both Kissy Suziki (Mie Hama) and Helga Brandt (Karin Dor). You Only Live Twice was one of Sean Connery's last outings as James Bond. The next Bond film, On Her Majesty's Secret Service, would star George Lazenby as 007, and while Connery would return for Diamonds Are Forever, in 1973, Roger Moore took over the role. (Connery would play Bond one last time, in 1983's Never Say Never Again, which was produced outside the official series.)"
Action,The Untamed Breed,The Untamed Breed (1948),8,Action,B-Western,Ranchers,"breeding, bull, cattle, animal, scheme, herd [group], rampage, neighbor, problems, ranch",31-May-48,USA,"All cruel jokes aside, actor Sonny Tufts did on occasion deliver something resembling a good screen performance. In the Columbia B-plus western The Untamed Breed, Tufts plays a Texas rancher hoping to improve his breed of cattle. The play is to purchase an expensive Brahma bull and allow the animal to commiserate with Tufts' bovine stock. Unfortunately the bull is not agreeable to this setup; it goes on a rampage, killing off much of the cattle on neighboring ranches. Untamed Breed wavers between some well staged dramatic sequences and the usual all-stops-out gunplay."
Action,Time and Tide,Time and Tide (2000),8,Action,Action Thriller,Adrenaline Rush,"friendship, gangster, gang-war, undercover, drunk, pregnancy",19-Oct-00,Hong Kong,"Two men who have a great deal in common become friends, only to find themselves turned into enemies in this slam-bang action fest from Hong Kong. Tyler (Nicholas Tse) is a man trying to make a career in a rough section of Hong Kong. One night, after several drinks too many, he hooks up with Ah Jo (Cathy Chui), an off-duty undercover cop who has also had a bit more alcohol than usual. Tyler and Ah Jo spend the night together, even though she usually prefers the company of women, and Ah Jo soon finds she's pregnant. Ah Jo has no desire to remain involved with Tyler, but he wants to do the right thing, so he takes a job as a bodyguard for low-level gangster Uncle Ji (Anthony Wong) and sends her his money, all the while wishing he could be in Brazil. Meanwhile Jack (Wu Bai), who once lived in Brazil, is back in Hong Kong with his very pregnant wife Ah Hui (Candy Lo), the daughter of a triad kingpin targeted by Brazilian gangsters. Uncle Ji is in charge of protecting the triad leader, and he makes Tyler one of his right-hand men. Tyler and Jack get to know one another and become close friends, but their friendship comes to an end when the Brazilian mob makes Jack an offer he can't refuse, putting the two men on opposite sides of a gangland war. Seunlau Ngaklau was directed by Tsui Hark, who returned to Hong Kong filmmaking after a brief sojourn in Hollywood."
Action,Secret Enemies,Secret Enemies (1942),8,Action,Unglamorized Spy Film,Nail-biters,"espionage, FBI (Federal Bureau of Investigation), killing, Nazi, tracking [following], enemy, G-man, capture, lodge, secrets, city, war",17-Sep-42,USA,"Made in 1942 but released early in 1943, Secret Enemies is a Warner Bros. espionage quickie, putting the studio's second-echelon contractees to good use. Craig Stevens, Faye Emerson and John Ridgely are the leads in this hour-long meller about a Nazi spy ring operating covertly in America. The FBI sniffs out the ""secret enemies,"" striking another blow against Uncle Adolf. Secret Enemies enabled Faye Emerson to step up into ""A"" pictures and secured a contract extension for reliable utility player John Ridgely. But Craig Stevens was drafted almost immediately after the film's release; unable to regain his lost footing after the war, it would take Stevens until 1958 to establish himself as a full-fledged star on the TV series Peter Gunn."
Action,Tiger Shark,Tiger Shark (1932),8,Action,Adventure Drama,,"love-triangle, fishing, friendship, jealousy, rescue, sea, shark, wedding, death, sexual-attraction, boating",22-Sep-32,USA,"It is difficult to determine who is the more ferocious character in this film: The real shark seen in the underwater sequences, or star Edward G. Robinson. Robinson plays a Portuguese tuna boat skipper--the self-styled ""best dam' fisherman in the Pacific""--who years earlier had lost his hand to a shark while rescuing best friend Richard Arlen. Robinson promises to look after the daughter (Zita Johann) of a recently deceased crew member. He proposes marriage; she accepts, more out of gratitude than love. The girl eventually falls for Robinson's pal Arlen, who wants to break off the relationship before Robinson gets hurt. But Robinson catches the lovers together, and vows to kill Arlen. In attempting to throw his ex-friend to the sharks, Robinson is accidentally pulled overboard to his own death. Warner Bros. would unofficially remake Tiger Shark several times over the next ten years; while the professions of the two leading male characters would change, the basic ""triangle"" plot remained the same."
Action,Demon Fist of Kung Fu,Demon Fist of Kung Fu (1976),8,Action,Martial Arts,,"martial-arts, Kung-Fu, revenge, death, man",,USA,
Action,Seven in Darkness,Seven in Darkness (1969),8,Action,Adventure Drama,Nail-biters,"blindness [physical], survivor, accident, airplane, plane-crash, struggle, fear, group, wilderness",,USA,"Seven in Darkness has the distinction of being the first made-for-TV ""ABC Movie of the Week."" The ""seven"" are all blind people, passengers on a flight en route to a convention for the visually impaired. The plane crashes, forcing the sightless seven to struggle for survival in the hostile wilderness. Arthur O'Connell is given ""special guest star"" billing, a reliable tip-off as to which of the seven dies first. The rest of the party includes Dina Merrill, Barry Nelson, Sean Garrison, Milton Berle, Alejandro Rey and Lesley Ann Warren."
Action,V,V (1983),8,Action,Alien Film,"Nail-biters,Fantastic Reality","alien [not human], America, earth, world-domination, battle [war], freedom-fighter, forces [military]",,USA,"In this sprawling television miniseries, originally aired in May 1983 on NBC, a race of seemingly human-like aliens arrive en masse on Earth. These ""Visitors"" promise cooperation and friendship -- then launch a clandestine takeover of the planet by accusing the entire scientific and medical community of conspiring to destroy them, then finally ""benevolently"" seizing power. Inspired by Sinclair Lewis' It Can't Happen Here, a 1935 account of a fictional fascist takeover of America, V uses a huge ensemble cast and an elliptical method of storytelling to trace the contact between humans and the Visitors, from the arrival of 50 giant flying saucers in low Earth orbit to the first major victory of the underground resistance that opposes the aliens. Major characters include Mike Donovan (Marc Singer), a television cameraman who leverages his experience filming in various war-torn locales to help expose the Visitors' true nature; news anchor Kristine Walsh (Jenny Sullivan), his sometime girlfriend, who allows her ambitions to cloud her journalistic judgment and becomes a pawn of the alien invasion; Juliet Parrish (Faye Grant), a young biochemist who finds herself thrust into the role of resistance leader; Abraham Bernstein (Leonardo Cimino), the patriarch of a Jewish family divided between the lessons of the Holocaust and the need to survive; Elias Taylor (Michael Wright), a petty thief who joins the resistance after the Visitors kill his doctor brother, Ben (Richard Lawson); and Robin Maxwell (Blair Tefkin), the surly eldest daughter of a scientist (Michael Durrell) who finds his family the target of harassment and intimidation. The Visitors, who assume common human first names as their monikers, include supreme leader John (Richard Herd); sultry science and security officer Diana (Jane Badler); hunky Brian (Peter Nelson); and gentle Willie (Robert Englund). V was written and directed by Kenneth Johnson, who initially envisioned the project as a less fanciful story of fascist aggression; when his pitch to NBC seemed to be faltering, Johnson allegedly added the alien angle extemporaneously, securing himself a green light and NBC a sweeps-week hit. The success of V spawned a second miniseries, V: The Final Battle, and a weekly TV series that lasted 19 episodes from 1984 to 1985. Johnson ended his association with the world of V halfway through production on the second miniseries, but his work on the Alien Nation TV spin-off years later would resurrect many of the themes of V. Actor Singer was already known to sci-fi fans as star of The Beastmaster, while Englund would go on to portray Freddy Krueger in countless Nightmare on Elm Street films."
Action,Dead or Alive,Dead or Alive (2000),8,Action,Action Thriller,Button Pushers,"drug-ring, narcotics-agent, nemesis, underworld",5-Nov-99,Japan,"Takashi Miike takes a dime-a-dozen yakuza script and turns it inside out in this high-octane surrealist crime action thriller. The film's first ten minutes is a breathless montage depicting a naked woman clutching a bag of cocaine being thrown off a high-rise, a porcine Chinese gangster devouring bowl after bowl of noodles before getting whacked, a tinsel-wigged stripper in mid-grind, another Chinese gangster having sex with a guy in a pubic bathroom, clowns throwing knives, and the world's longest cocaine line. Welcome to planet Miike -- one that seems unnervingly like reality but just tweaked enough that the viewer believes almost anything can (and does) happen. What follows is a tale pitting narcotics cop Jojima (Sho Aikawa), who has an ailing daughter and a neglected wife, against Ryuichi (Riki Takeuchi), a Chinese-born gangster sporting a hairstyle that would make Wayne Newton jealous. As Ryuichi tries to muscle in on a big drug haul from Taiwan, those closest to him get killed -- particularly his whey-faced younger brother and girlfriend (the latter meets a particularly grizzly end at the hands of a sadistic scat-enthusiast yakuza). Likewise, Jojima, who is on Ryuichi's tail, looses his partner, his wife, and his daughter. Soon the two are on the road to a literally cataclysmic confrontation."
Action,Short Grass,Short Grass (1950),8,Action,Traditional Western,Nail-biters,"name-clearing, against-all-odds, lawyer, love, ranch, land-scheme, romance",,USA,"Western aficionados tend to regard Short Grass as the best-ever directorial effort by Lesley Selander. Considerably longer than most Monogram westerns (82 minutes), the film never lags, thanks to the expertise of Selander and a top-rank cast. Rod Cameron plays Steve, a drifter who briefly settles down on a ranch. During a range war, Steve comes to blows with avaricious rancher Hal Fenton (Morris Ankrum). Shortly thereafter, a man is killed and Steve is implicated in the crime. He leaves town in a hurry, returning five years later to clear his name and reclaim his land. He finds that his former girl friend Sharon (Cathy Downs) is married to alcoholic newspaperman John Devore (Tris Coffin), and that Fenton now holds the commuity in an iron grip of fear. Lawman Keown (Johnny Mack Brown) can't administer justice because of the political strings pulled by the villains. With Steve's help, Keown and the rest of the town's honest citizens are finally able to swing into action, leading to a superbly staged climax. Comic actor Raymond Walburn essays a relatively straight role as the town's leading citizen."
Action,Squadron Leader X,Squadron Leader X (1943),8,Action,War Drama,,"war, agent [representative], bomb, double-agent, espionage, impersonation, Nazism, on-the-run, rescue, resistance-fighters, undercover",,"UK, USA","Erich Kohler (Eric Portman) is a decorated Luftwaffe pilot recruited for a daring propaganda mission in Belgium -- to drop bombs on a civilian target in Ghent and then parachute out wearing an British Royal Air Force uniform and, once on the ground, spread the story that the RAF is attacking civilian targets in the Nazi-occupied nation. Kohler, a dedicated Nazi who was educated in England and speaks unaccented English, is perfectly prepared to carry out his orders, but his mission goes awry when he immediately gets ""rescued"" by the Belgian underground, and put in with a group of real British flyers who are being returned to their homeland that very night. Now, with his life at risk, he must hide his real identity and fall in with them, going along for the trip to England. Once there, he tries to re-establish contact with people he knew who were sympathetic to Hitler, but discovers that those German emigres whom he could trust most are being interned. He looks up an old girlfriend (Ann Dvorak), who had some sympathy for the Hitler government, only to discover that she has begun thinking a lot more clearly about the Nazis, and for a time takes shelter with an emigre couple (Martin Miller, Beatrice Varley) whose cooperation is a result of coercion. But he needs more than shelter -- Kohler is already fearful of being caught by British intelligence, but soon learns that the German agents operating in England have orders to kill him, as well. Having failed in his mission, he is, at best, an embarrassment to the German nation, and a liability. He has no choice but to make the best escape he can, the way he knows best, into the air, and the safe neutral territory of Ireland."
Action,Tell It to the Marines,Tell It to the Marines (1926),8,Action,War Adventure,Tough Guys,"Marines, sergeant, basic-training [military], courage, love-triangle, nurse, rescue, romance, China, girl",23-Dec-26,USA,"A tough-as-nails Marine sergeant sets about training a rag-tag group of boys into men. Though sporting a rough and gruff exterior, the sergeant is really a caring, gentle sort. During training, he is especially rough on a smart-alecky young man, whom he hones into a first rate fighter. More tension arise between the men when they fall for the same girl. In one of the film's highlights the sarge, and his protege save an imperiled group, including the girl, from a vicious gang of Chinese bandits. After the rescue, the selfless sergeant gracefully steps aside and returns to training recruits to allow the heroic young Marine and the girl to find romantic bliss. Featuring a nice blend of comedy, adventure and romance, Tell It to the Marines was MGM's second highest grossing film of 1926. It is also one of the rare instances when Lon Chaney, known as ""the man of a thousand faces,"" appeared sans elaborate make-up."
