category,movie,title,rating,genre,subgenre,theme,keyword,releasedate,country,review
Action,"Crouching Tiger, Hidden Dragon","Crouching Tiger, Hidden Dragon (2000)",10,Adventure,Martial Arts,In the Mood for Love,"coming-of-age, forbidden-love, Kung-Fu, legend  [fable], love, master [expert], revenge, star-crossed-lovers, sword, swordfight, unrequited",8-Dec-00,"China, Hong Kong, Taiwan, USA","Taiwanese filmmaker Ang Lee took a break from making Western period dramas to fashion this wild and woolly martial arts spectacular featuring special effects and action sequences courtesy of the choreographer of The Matrix (1999), Yuen Woo Ping. In the early 19th century, martial arts master Li Mu Bai (Chow Yun-Fat) is about to retire and enter a life of meditation, though he quietly longs to avenge the death of his master, who was killed by Jade Fox (Cheng Pei-pei). He gives his sword, a fabled 400-year-old weapon known as Green Destiny, to his friend, fellow martial arts wizard and secret love Yu Shu Lien (Michelle Yeoh), so that she may deliver it to Sir Te (Sihung Lung). Upon arrival in Peking, Yu happens upon Jen (Zhang Ziyi), a vivacious, willful politician's daughter. That night, a mysterious masked thief swipes Green Destiny, with Yu in hot pursuit -- resulting in the first of several martial arts action set pieces during the film. Li arrives in Beijing and eventually discovers that Jen is not only the masked thief but is also in cahoots with the evil Jade. In spite of this, Li sees great talent in Jen as a fighter and offers to school her in the finer points of martial arts and selflessness, an offer that Jen promptly rebukes. This film was first screened to much acclaim at the 2000 Cannes, Toronto, and New York film festivals and became a favorite when Academy Awards nominations were announced in 2001: Tiger snagged ten nods and later secured four wins for Best Cinematography, Score, Art Direction, and Foreign Language Film."
Action,The French Connection,The French Connection (1971),10,Crime,Police Detective Film,"Tough Guys,Adrenaline Rush","police-detective, drug-ring, big-city, chase, drug-bust, heroin, war-on-drugs, subway, train [locomotive]",,USA,"This gritty, fast-paced, and innovative police drama earned five Academy Awards, including Best Picture, Best Adapted Screenplay (written by Ernest Tidyman), and Best Actor (Gene Hackman). Jimmy ""Popeye"" Doyle (Hackman) and his partner, Buddy Russo (Roy Scheider), are New York City police detectives on narcotics detail, trying to track down the source of heroin from Europe into the United States. Suave Alain Charnier (Fernando Rey) is the French drug kingpin who provides a large percentage of New York City's dope, and Pierre Nicoli (Marcel Bozzuffi) is a hired killer and Charnier's right-hand man. Acting on a hunch, Popeye and Buddy start tailing Sal Boca (Tony Lo Bianco) and his wife, Angie (Arlene Faber), who live pretty high for a couple whose corner store brings in about 7,000 dollars a year. It turns out Popeye's suspicions are right -- Sal and Angie are the New York agents for Charnier, who will be smuggling 32 million dollars' worth of heroin into the city in a car shipped over from France. The French Connection broke plenty of new ground for screen thrillers; Popeye Doyle was a highly unusual ""hero,"" an often violent, racist, and mean-spirited cop whose dedication to his job fell just short of dangerous obsession. The film's high point, a high-speed car chase with Popeye tailing an elevated train, was one of the most viscerally exciting screen moments of its day and set the stage for dozens of action sequences to follow. And the film's grimy realism (and downbeat ending) was a big change from the buff-and-shine gloss and good-guys-always-win heroics of most police dramas that preceded it. The French Connection was inspired by a true story, and Eddie Egan and Sonny Grosso, Popeye and Buddy's real life counterparts, both have small roles in the film. A sequel followed four years later."
Action,Raiders of the Lost Ark,Raiders of the Lost Ark (1981),10,Action,Costume Adventure,Adrenaline Rush,"hero, snake, escape, good-vs-evil, treasure, villain, artifact, chase, danger, globetrotter, journey, Nazism, search, against-all-odds, archaeology, evil, jungle, mercenary, love, romance",7-Sep-12,USA,"Indiana Jones (Harrison Ford) is no ordinary archeologist. When we first see him, he is somewhere in the Peruvian jungle in 1936, running a booby-trapped gauntlet (complete with an over-sized rolling boulder) to fetch a solid-gold idol. He loses this artifact to his chief rival, a French archeologist named Belloq (Paul Freeman), who then prepares to kill our hero. In the first of many serial-like escapes, Indy eludes Belloq by hopping into a convenient plane. So, then: is Indiana Jones afraid of anything? Yes, snakes. The next time we see Jones, he's a soft-spoken, bespectacled professor. He is then summoned from his ivy-covered environs by Marcus Brody (Denholm Elliott) to find the long-lost Ark of the Covenant. The Nazis, it seems, are already searching for the Ark, which the mystical-minded Hitler hopes to use to make his stormtroopers invincible. But to find the Ark, Indy must first secure a medallion kept under the protection of Indy's old friend Abner Ravenwood, whose daughter, Marion (Karen Allen), evidently has a ""history"" with Jones. Whatever their personal differences, Indy and Marion become partners in one action-packed adventure after another, ranging from wandering the snake pits of the Well of Souls to surviving the pyrotechnic unearthing of the sacred Ark. A joint project of Hollywood prodigies George Lucas and Steven Spielberg, with a script co-written by Lawrence Kasdan and Philip Kaufman, among others, Raiders of the Lost Ark is not so much a movie as a 115-minute thrill ride. Costing 22 million dollars (nearly three times the original estimate), Raiders of the Lost Ark reaped 200 million dollars during its first run. It was followed by Indiana Jones and the Temple of Doom (1985) and Indiana Jones and the Last Crusade (1989), as well as a short-lived TV-series ""prequel."""
Action,The Revenant,The Revenant (2015),10,Action,Adventure Drama,Tough Guys,,25-Dec-15,USA,"In 1820s America, frontiersman and fur trapper Hugh Glass (Leonardo DiCaprio) and his teenage son Hawk (Forrest Goodluck) join a pelt-gathering expedition. However, their party are attacked by Arikara Native Americans, who kill a number of the men. Glass then tries to lead the remainder of the group to safety, charting a new path to a U.S. fort. Unfortunately, he is soon mauled by a grizzly bear while hunting for food, and is horribly wounded. He is left in the care of roughneck John Fitzgerald (Tom Hardy) and the young and inexperienced Jim Bridger (Will Poulter), while Hawk watches on in horror. Fitzgerald betrays him and leaves him buried alive in a shallow grave, but Glass nurses himself back to health and sets out to seek revenge. Alejandro González Iñárritu directed this pulse-pounding epic."
Action,Thelma & Louise,Thelma & Louise (1991),10,Comedy Drama,Road Movie,Only Human,"women, friendship, on-the-run, rescue, vacation, killing, rape",24-May-91,"Australia, France, USA","Geena Davis and Susan Sarandon play Thelma and Louise, two working-class friends who together have planned a weekend getaway from the men in their lives. Thelma's husband, Darryl (Chris McDonald), is an overbearing oaf, and Louise's boyfriend, Jimmy (Michael Madsen), simply will not commit. Though the road trip starts out as a good time, the pair eventually wind up at a bar. A tipsy Thelma ends up in the parking lot of the bar with a would-be rapist. Louise shoots the man dead. The two decide that they have no choice but to go on the run. They eventually meet up with a young criminal named J.D. (Brad Pitt), whose cowboy spirit rubs off on the timid Thelma. The pair is pursued by a police officer (Harvey Keitel) sympathetic toward their plight. He chases them to the Grand Canyon, where the women make a fateful decision about their lives. Directed by Ridley Scott, Thelma & Louise brought first-time screenwriter Callie Khouri many accolades including the Oscar for Best Original Screenplay."
Action,The Treasure of the Sierra Madre,The Treasure of the Sierra Madre (1948),10,Action,Adventure Drama,"Tough Guys,Adrenaline Rush","betrayal, friendship, greed, outlaw [Western], prospector, scheme, search, suspicion, treasure",24-Jan-48,USA,"John Huston's 1948 treasure-hunt classic begins as drifter Fred C. Dobbs (Humphrey Bogart), down and out in Tampico, Mexico, impulsively spends his last bit of dough on a lottery ticket. Later on, Dobbs and fellow indigent Curtin (Tim Holt) seek shelter in a cheap flophouse and meet Howard (Walter Huston), a toothless, garrulous old coot who regales them with stories about prospecting for gold. Forcibly collecting their pay from their shifty boss, Dobbs and Curtin combine this money with Dobbs's unexpected windfall from a lottery ticket and, together with Howard, buy the tools for a prospecting expedition. Dobbs has pledged that anything they dig up will be split three ways, but Howard, who's heard that song before, doesn't quite swallow this. As the gold is mined and measured, Dobbs grows increasingly paranoid and distrustful, and the men gradually turn against each other on the way toward a bitterly ironic conclusion. The Treasure of the Sierra Madre is a superior morality play and one of the best movie treatments of the corrosiveness of greed.  Huston keeps a typically light and entertaining touch despite the strong theme, for which he won Oscars for both Director and Screenplay, as well as a supporting award for his father Walter, making Walter, John, and Anjelica Huston the only three generations of one family all to win Oscars."
Action,The Dark Knight,The Dark Knight (2008),9,Crime,Crime Drama,"Abandon All Hope,A World of Its Own","mask [disguise], secret-identity, disguise, crimefighter, Superhero, clown",18-Jul-08,USA,"Christopher Nolan steps back into the director's chair for this sequel to Batman Begins, which finds the titular superhero coming face to face with his greatest nemesis -- the dreaded Joker. Christian Bale returns to the role of Batman, Maggie Gyllenhaal takes over the role of Rachel Dawes (played by Katie Holmes in Batman Begins), and Brokeback Mountain star Heath Ledger dons the ghoulishly gleeful Joker makeup previously worn by Jack Nicholson and Cesar Romero. Just as it begins to appear as if Batman, Lt. James Gordon (Gary Oldman), and District Attorney Harvey Dent (Aaron Eckhart) are making headway in their tireless battle against the criminal element, a maniacal, wisecracking fiend plunges the streets of Gotham City into complete chaos."
Action,Skyfall,Skyfall (2012),9,Action,Action Thriller,Adrenaline Rush,"mission [quest], spy",8-Nov-12,USA,"007 (Daniel Craig) becomes M's only ally as MI6 comes under attack, and a mysterious new villain emerges with a diabolical plan. James Bond's latest mission has gone horribly awry, resulting in the exposure of several undercover agents, and an all-out attack on M16. Meanwhile, as M (Judi Dench) plans to relocate the agency, emerging Chairman of the Intelligence and Security Committee Mallory (Ralph Fiennes) raises concerns about her competence while attempting to usurp her position, and Q (Ben Whishaw) becomes a crucial ally. Now the only person who can restore M's reputation is 007. Operating in the dark with only field agent Eve (Naomie Harris) to guide him, the world's top secret agent works to root out an enigmatic criminal mastermind named Silva (Javier Bardem) as a major storm brews on the horizon. Albert Finney also stars in the 23rd installment of the long-running spy series. The film was directed by Sam Mendes (American Beauty, Revolutionary Road) and shot by acclaimed cinematographer Roger Deakins (True Grit, The Reader, The Assassination of Jesse James by the Coward Robert Ford)."
Action,Hell or High Water,Hell or High Water (2016),9,Action,,Only Human,"bank, bank-robbery, desert, foreclosure, manhunt, police, poverty",12-Aug-16,USA,"Two desperate brothers -- one a divorced father (Chris Pine), the other a hard-living ex-con (Ben Foster) -- commit a string of bank robberies in order to raise the money needed to protect their family farm from foreclosure. Meanwhile, an aging sheriff (Jeff Bridges) tracks the heists in an attempt to hunt down those responsible. This crime drama was written by Taylor Sheridan (Sicario) and directed by David Mackenzie (Starred Up)."
Action,Die Hard,Die Hard (1988),10,Action,Action Thriller,"Tough Guys,Adrenaline Rush","hostage, captor, high-rise, police-negotiator, rescue, marital-problems, one-against-odds, captive, escape, police, terrorism",15-Jul-88,USA,"It's Christmas time in L.A., and there's an employee party in progress on the 30th floor of the Nakatomi Corporation building. The revelry comes to a violent end when the partygoers are taken hostage by a group of terrorists headed by Hans Gruber (Alan Rickman), who plan to steal the 600 million dollars locked in Nakatomi's high-tech safe. In truth, Gruber and his henchmen are only pretending to be politically motivated to throw the authorities off track; also in truth, Gruber has no intention of allowing anyone to get out of the building alive. Meanwhile, New York cop John McClane (Bruce Willis) has come to L.A. to visit his estranged wife, Holly (Bonnie Bedelia), who happens to be one of the hostages. Disregarding the orders of the authorities surrounding the building, McClane, who fears nothing (except heights), takes on the villains, armed with one handgun and plenty of chutzpah. Until Die Hard came along, Bruce Willis was merely that wisecracking guy on Moonlighting. After the film's profits started rolling in, Willis found himself one of the highest-paid and most sought-after leading men in Hollywood."
Action,The Towering Inferno,The Towering Inferno (1974),8,Action,Disaster Film,Adrenaline Rush,"fire, skyscraper, disaster, firefighter, fire-disaster, electrical-wiring, security-guard, ceremony, dedication",,USA,"A skyscraper and an all-star cast go up in flames in Irwin Allen's classic disaster movie. To celebrate the construction of the Glass Tower, the world's tallest building, architect Doug Roberts (Paul Newman) and builder James Duncan (William Holden) hold a gala bash on the highest floors. Trouble is, Duncan's son-in-law and electrical subcontractor Roger Simmons (Richard Chamberlain) installed faulty wiring throughout the 138-story behemoth to save money. While the guests --  including Doug's lady friend (Faye Dunaway), a rich widow (Jennifer Jones), a con man (Fred Astaire), and a politico (Robert Vaughn) -- enjoy the party, and a security guard (O.J. Simpson) wonders why his equipment is on the fritz, a burnt-out circuit breaker ignites some garbage on the 85th floor, swiftly turning the high-rise into, well, a towering inferno. With the guests trapped on the 135th floor, it's up to Roberts and Fire Chief O'Hallorhan (Steve McQueen) to find a way to stop the blaze. Though not the first all-star '70s disaster movie (1970's Airport and 1972's The Poseidon Adventure preceded it), The Towering Inferno was the most popular and the most spectacular. In a move that would become more common in late-'90s blockbuster Hollywood, The Towering Inferno's mammoth production was mounted by two studios; screenwriter Stirling Silliphant combined the two novels owned by the studios into one saga. 1970s ""shake 'n bake"" maestro Allen, with co-director John Guillermin (Allen did the action sequences), tapped into deep fears about the fragility of modern life in the face of extreme natural phenomena, as well as into the envies and insecurities of middle-aged professional men. The Towering Inferno packed theaters and earned eight Oscar nominations, including Best Picture; it won for Cinematography, Editing, and Song. While its heroic, no-nonsense men provided some traditional comfort, The Towering Inferno still might provoke second thoughts about going into a skyscraper."
Action,Casino Royale,Casino Royale (2006),8,Action,Glamorized Spy Film,Adrenaline Rush,"secret-agent, casino, poker, terrorism, Bahamas, gambling, mission [quest], parkour",17-Nov-06,"Czech Republic, Germany, UK, USA","Actor Daniel Craig assumes the role formerly occupied by such screen greats as Sean Connery, Roger Moore, and Timothy Dalton to set out on the character's very first 007 mission. James Bond has earned his ""00"" status by masterfully executing a pair of death-defying professional assassinations. Now assigned the task of traveling to Madagascar to spy on notorious terrorist Mollaka (Sebastien Foucan) for his maiden voyage as a 007 agent, Bond boldly goes against MI6 policy to launch an independent investigation that finds him traversing the Bahamas in search of Mollaka's notoriously elusive terror cell. Subsequently led into the company of the mysterious Dimitrios (Simon Abkarian) and his exotic girlfriend, Solange (Caterina Murino), Bond soon realizes that he is closer than ever to locating well-guarded terrorist financier Le Chiffre (Mads Mikkelsen), the man who has personally bankrolled some of the most prevalent terrorist organizations on the planet. When Bond learns that Le Chiffre is planning to partake in an upcoming high-stakes poker game to be played at Montenegro's Le Casino Royale and use the winnings to establish his financial grip on the globe, M (Judi Dench) assigns beguiling agent Vesper (Eva Green) the task of watching over the fledgling agent as he plays against Le Chiffre in a covert attempt to destroy the nefarious gambler's well-established monetary stronghold in the underworld once and for all. Bond will need more than his legendary gambling skills in order to win this dangerous game, though, and after allying himself with local MI6 field agent Mathis (Giancarlo Giannini) and CIA operative Felix Leiter (Jeffrey Wright), the endlessly suave super-spy puts on his poker face for a high-stakes game of cards in which the stakes are not measured in dollars, but human lives."
Action,House of Flying Daggers,House of Flying Daggers (2004),8,Action,Period Film,"In the Mood for Love,Eyepoppers","political-unrest, dynasty, lawman, revolution, dancer, love, rebel, star-crossed-lovers, swordsman, corruption, brothel",3-Dec-04,"China, Hong Kong","Chinese director Zhang Yimou fuses a martial arts action-drama with a tragic romance in this elegant period piece. In the year 859 A.D., as the Tang dynasty is beset by rebellion, Leo (Andy Lau) and Jin (Takeshi Kaneshiro) are a pair of lawmen who have been given the task of ferreting out the leaders of a revolutionary faction known as the Flying Daggers. Working on a tip that members of the group are working out of a brothel called the Peony Pavilion, Jin arrives there in disguise and is introduced to a beautiful blind dancer named Mei (Zhang Ziyi). After watching Mei's performance following several drinks, Jin drunkenly attempts to have his way with her, and Leo is forced to intervene. After gaining Mei's trust in a game of skill, Leo arrests her and informs her that she'll be tortured if she doesn't tell all she knows about the Flying Daggers. Jin responds by helping Mei break out of prison, but he has an ulterior motive -- by following her, Leo and Jin are certain she'll lead them to the Flying Daggers. However, as he helps the blind girl find her way back home, Jin finds himself falling in love with Mei, and isn't certain if he's willing to betray her again."
Action,Das Boot,Das Boot (1981),10,War,Sea Adventure,"Memory Lane,Gutbusters,Nail-biters","submarine, captain [military], German [nationality], commander, sea-battle, war",,"Germany, West Germany","Das Boot is one of the most gripping and authentic war movies ever made. Based on an autobiographical novel by German World War II photographer Lothar-Guenther Buchheim, the film follows the lives of a fearless U-Boat captain (Jurgen Prochnow) and his inexperienced crew as they patrol the Atlantic and Mediterranean in search of Allied vessels, taking turns as hunter and prey. There's very little plot, so the movie's power comes from both its riveting, epic battle scenes and its details of the boring hours spent waiting for orders or signs of the enemy. With the exception of one staunch Hitler Youth lieutenant, none of the crew is particularly loyal to the Nazis, and some are openly hostile toward their Fuhrer; this allows viewer sympathy with the men as they perform their laborious, monotonous duties in cramped, filthy quarters, or await death as depth charges explode all around the sub. Prochnow is excellent as the nerves-of-steel commander, and many of the supporting actors -- all German -- are solid as well, although the characterizations border on war movie clichés (the young crewman who has left behind his pregnant girlfriend, the Chief Engineer whose wife is seriously ill). The real star, however, is cinematographer Jost Vacano, who makes the sub's grimy, claustrophobic interior come to vivid life, as his camera follows the crew through hatches, up ladders, into bunks, and under pipes, creating a palpable sense of claustrophobia while injecting it with movement. Originally edited by writer/director Wolfgang Petersen as both a two-and-a-half hour theatrical release and a six-hour German miniseries, Das Boot was re-released in a restored version in 1997 with nearly one hour of added footage which made it even more suspenseful than before."
Action,The Poseidon Adventure,The Poseidon Adventure (1972),8,Action,Disaster Film,Adrenaline Rush,"cruise, escape, high-seas, minister, oceanliner, passenger, rescue, sea-disaster, survivor, tidal-wave, trapped, underwater, voyage",,USA,"The Poseidon is an ocean liner charting its course on New Year's Eve. Just after midnight, Captain Harrison (Leslie Nielsen) spots the mother of all tidal waves. It is the last thing that Harrison and practically everyone else onboard sees before drowning -- the Poseidon is turned upside down, with only a handful of survivors. The ten lucky ones -- including Mike Rogo (Ernest Borgnine), Linda Rogo (Stella Stevens), Acres (Roddy McDowall), Belle Rosen (Shelley Winters), and Manny Rosen (Jack Albertson) -- led by no-nonsense minister Frank Scott (Gene Hackman), desperately attempt to climb from the top of the ship (now submerged) to the bottom (now ""the top""). The film's theme song, ""The Morning After,"" sung by Maureen McGovern, earned an Oscar. In addition, The Poseidon Adventure received the Special Achievement Award for Special Effects; L.B. Abbott and A.D. Flowers were the recipients. A sequel, Beyond the Poseidon Adventure, came out in 1979."
Action,Mad Max: Fury Road,Mad Max: Fury Road (2015),9,Action,Action Thriller,Adrenaline Rush,"Australia, chase, crash, desert, escape, post-apocalypse",15-May-15,"Australia, USA","In this long-awaited reboot of the landmark series that helped define the postapocalyptic genre, loner Max (Tom Hardy) joins forces with the mysterious Imperator Furiosa (Charlize Theron) and a group of warrior women as they flee from an evil despot across a sun-parched wasteland."
Action,Spider-Man 2,Spider,9,Action,Superhero Film,Adrenaline Rush,"Superhero, mad-scientist, science-runs-amok, tentacles, villain, secret-identity, friendship, revenge",25-Jun-04,USA,"Stan Lee's all-too-human superhero returns to the screen in this highly anticipated sequel to 2002's blockbuster hit Spider-Man. Peter Parker (Tobey Maguire) is attempting to juggle college classes and his job as a photographer with the Daily Bugle while maintaining his secret life as costumed crime-fighter Spider-Man. Parker is also struggling to hold on to his relationship with Mary Jane Watson (Kirsten Dunst), who is beginning to enjoy success as a model and actress, and both Mary Jane and Peter have noticed he's beginning to buckle under the strain. Parker's friendship with Harry Osborn (James Franco) is also beginning to fray due to Peter's seeming alliance with Spider-Man, whom Harry blames for the death of his father, the nefarious Norman Osborn. As Parker weighs his responsibilities to himself and those around him against the obligations that come with his special powers, Spider-Man is faced with a new nemesis -- Dr. Otto Octavius (Alfred Molina), a deranged scientist whose latest project has turned him into the near-invincible cyborg Doctor Octopus. Spider-Man 2 was directed by Sam Raimi, who helmed the first film, and much of the original cast has also reunited for this sequel, including Rosemary Harris, J.K. Simmons, and Bruce Campbell."
