category,movie,title,rating,genre,subgenre,theme,keyword,releasedate,country,review
Adult,Fanny Hill: Memoirs of a Woman of Pleasure,Fanny Hill: Memoirs of a Woman of Pleasure (1964),6,Adult,Sexploitation,,"brothel, prostitute/prostitution, virgin",,"USA, West Germany","Russ Meyer's sex films of the 1960s invariably promised more than they delivered. To be sure, there were bosoms and bottoms aplenty, but seldom if ever any full nudity or orgasmic activity (simulated or otherwise). Fanny Hill: Memoirs of a Woman of Pleasure, based on a dull, overwritten 18th century ""bawdy"" novel, was filmed in West Germany by exploitation producer Albert Zugsmith. Miriam Hopkins, old enough to know better, is the one ""name"" star of this messy romp, playing the mentor of the titular (in every sense of the word) Fanny Hill (Laetitia Roman), who after being cast aside by the world at large is given shelter in a brothel. His acute self-promotional skills aside, Russ Meyer never really learned how to direct; his ""style"" consisted of seconds-lasting closeups wedged into badly composed long shots, substituting speed and energy for skill. But he certainly knew his audience, as proven by the enormous worldwide box office take for Fanny Hill: Memoirs of a Woman of Pleasure."
Adult,Russ Meyer's Pandora Peaks,Russ Meyer's Pandora Peaks (2001),6,Adult,Adult Entertainment,,,,,"Adult cinema director Russ Meyer returns to the screen for his first time in 20 years with this documentary about big-breasted (Triple H cup) strip dancer Pandora Peaks. Meyer combines biographical info on the chesty exhibitionist with plenty of Peaks' sexy routines, as well as snippets of his own cinematic history. Reminiscent of the director's earlier Mondo Topless, the film is a collision of rapidly moving montage sequences that supply acres of skin along with Meyer's own lecherous sense of humor. The pneumatic Peaks is shown dancing in dusty desert locales, drinking at a German Oktoberfest, and enjoying a stimulating workout on her Trimax machine. Meyer is also a frequent face, trout fishing with a variety of Army buddies and mugging impishly at his over-endowed subject. The film includes appearances from busty starlets such as Tundi, Leosha, and Candy Samples and brings back Anthony James Ryan to briefly reprise his role from Eve and the Handyman."
Adult,Pink Narcissus,Pink Narcissus (1971),6,Adult,Gay & Lesbian Films,,"homosexual, sex",,USA,"Though not hardcore per se, this is an X-rated erotic homosexual film with copious amounts of male nudity. Apparently originally filmed as a worshipful tribute to its star Bobby Kendall, it had to be later trimmed by editor Martin Jay Sadoff due to the cameraman/director's refusal to cut any portion of it. Basically, it shows Kendall again and again in many different settings and guises and focuses lovingly on portions of his anatomy (especially his well-formed backside), teasingly promising to show him frontally. All settings, whether indoors or out, are indicated by cartoon-like handmade props; the film has a rococo quality which made it successful in arthouse showings."
Adult,Virtual Encounters 2,Virtual Encounters 2 (1998),6,Adult,Sci-Fi Comedy,"Virtual Reality,Sexual Awakening,College Life","business, campus, computers, cyber-space, nerd, sex, virtual-reality",,,"In this erotic comedy-drama, a pair of computer geeks decide to spice up their (many) lonely nights with a virtual reality setup that allows them to accurately simulate they sex they haven't been having. When words spreads around campus about the gizmo, guys are lined up around the block to try it, and they find themselves the proprietors of a booming business. Even better, their new BMOC status makes them a hot ticket with the ladies on campus, and they discover there are certain things a computer can't reproduce with 100% accuracy."
Adult,Koibitotachi wa Nureta,Koibitotachi wa Nureta (1973),6,Adult,Crime Drama,"Unrequited Love,On the Run","hideout, hometown, killing, movie-theater",,Japan,"A Pinku cinema classic celebrated for its bold sexuality, director Tatsumi Kumashiro's scintillating erotic drama tells the tale of Katsu (Tetsu Oe), a man who flees to his childhood village after killing a member of the yakuza, and falls for a sexually liberated cinema owner while attempting to maintain a low profile. Refusing to reveal himself even to his mother, Katsu is crestfallen to find that Yuko, the object of his obsession, is in a long-term romance with someone he's known since childhood."
Adult,Erotic Witch Project 2: Book of Seduction,Erotic Witch Project 2: Book of Seduction (2001),6,Adult,Sex Horror,,"eroticism, lesbianism, mental-institution, sex, witch",,USA,"The companies behind Vampire's Seduction and the original Erotic Witch Project, Seduction Cinema and Ventura Distribution present this sequel to the straight-to-video softcore take on The Blair Witch Project. Released in 2001, Erotic Witch Project 2: Book of Seduction was written and directed by John Bacchus and tells the story of a young woman's erotic exploits in a mental hospital after the sensual powers of the Erotic Witch turn her into a lesbian with an insatiable appetite for sex. The film stars Darian Caine and Katie Jordan and is intended for a mature audience."
Adult,Lip Service,Lip Service (1999),4,Adult,Erotic Thriller,"Private Eyes,Missing Persons","celebrity, Hollywood, missing-person, private-detective",,,Private eyes (who happen to be female) in Hollywood take on the case of a missing celebrity.
Adult,Element of Truth,Element of Truth (1995),4,Adult,Sex Comedy,Cons and Scams,"lover, seduction, woman",,USA,"In this drama, a beautiful woman uses her charms to dupe her new sweetheart and his buddies."
Adult,Exit in Red,Exit in Red (1996),3,Adult,Erotic Thriller,"Treacherous Spouses,Femmes Fatales","desert, extramarital-affair, frame-up, lover, psychiatrist, sexual-harassment, torture",,USA,"In Yurek Bogayevicz's Exit in Red, Mickey Rourke plays Ed Altman, a Beverly Hills psychiatrist who moves to Palm Springs in order to escape sexual harassment charges. Instead, he has an affair with a wealthy married woman named Ally (Annabel Schofield) who is planning to frame Ed for the murder of her husband, which she is planning with her crazy lover Nick (Anthony Michael Hall). To punish Nick for his complicity in the setup, Altman makes him drive through the desert wearing several layers of winter clothing before putting him in the trunk and shooting him in the nose. This occurs after Altman is able to escape from the police because a truck just happens to crash through the wall of the police station. The whole thing ends with a triple-cross of Nick by Ally and a bloody shootout which only Altman survives."
Adult,Emmanuelle in Soho,Emmanuelle in Soho (1981),3,Adult,Erotic Drama,"Voyeurs,Dangerous Attraction","prostitute/prostitution, sex",,France,"In this entry in the erotic Emmanuelle series, the tasty French tart samples the sensuous smorgasbord to be found in London's Soho area."
Adult,Body of Influence 2,Body of Influence 2 (1996),2,Adult,Erotic Thriller,"Femmes Fatales,Dangerous Attraction","danger, doctor/nurse, forbidden-love, intimacy, patient [medical], psychiatry, secrets",,USA,"In this erotic psycho-thriller, the relationship between a doctor and his seductive patient becomes dangerously intimate as they gradually reveal dark secrets from their pasts."
Adult,Bikini Summer 3: South Beach Heat,Bikini Summer 3: South Beach Heat (1997),2,Adult,Beach Film,,beauty-pageant,,USA,"In this sexy, sun-drenched outing, a buxom makeup artist allows the coordinator of a Miami beauty contest to convince her to enter and display her considerable womanly charms."
Adult,Broadcast Bombshells,Broadcast Bombshells (1995),2,Adult,Sex Comedy,"Members of the Press,Ladder to the Top","anchorperson, behind-the-scenes, bomb, broadcasting, rival, television",,USA,"In this sexy comedy, a beautiful, ambitious young woman schemes to become the newest anchorwoman at TV station WSEX, but before she can, she must first get rid of her rival."
Adult,Roots of Evil,Roots of Evil (1991),3,Adult,Erotic Thriller,,"detective, eroticism, investigation, killing, murder, police, prostitute/prostitution, serial-killer, sex, tracking [following]",,USA,"In this violent erotic screamer, two cops are after a serial killer who has been slaying beautiful Hollywood prostitutes."
Adult,Erotic Delights,Erotic Delights (1995),2,Adult,Softcore Sex Film,,,,,"In this sexy adventure, a dutiful Marco Polo honors an Oriental emperor's request by escorting the royal leader's toothsome daughter to an ally's distant kingdom."
Adult,Return to Two Moon Junction,Return to Two Moon Junction (1994),3,Adult,Romantic Drama,"Sexual Awakening,Otherwise Engaged,Infidelity,Dangerous Attraction","hometown, modeling, money, return, sex, Southerner",,USA,"In this drama, a renowned model gives up her fame, glory and money to return to her quiet hometown in the South."
Adult,Pleasure Unlimited,Pleasure Unlimited (1986),2,Adult,Softcore Sex Film,,"bachelorette, bisexuality, boredom, group-sex, homemaker, sex, sexual-awakening",,,"Featuring lots of skin, this soft-core outing centers on the sexploits and adventures of a common housewife who finds herself engaging in orgies and lesbian sex."
Adult,Club Wild Side,Club Wild Side (1998),2,Adult,Softcore Sex Film,Infidelity,"film-critic, film-director, stripper, swinger",,USA,"This standard soft-core item concerns an innocent gal from the Midwest who gets involved with a swinging L.A. couple. The husband (James Horan) is an aspiring filmmaker having an affair with a movie critic, and their young guest discovers liberation by finding her true calling as a stripper. Another penetrating social document from Kelley Cauthen, the producer of Forbidden Games II. At least this one has cult starlet Monique Parent around to keep things interesting. Director Lawrence Unger returned with Inside Club Wild Side the same year."
Adult,Call Girl,Call Girl (1995),2,Adult,Softcore Sex Film,,"decadence, escort-service, photography, prostitute/prostitution",,USA,"In this steamy softcore outing, a starving young photographer takes a job at an escort service and there discovers that world can be a kinky place indeed."
Adult,Sixteen,Sixteen (1972),5,Adult,Softcore Sex Film,,"boy, coming-of-age, determination, girl, naivete",,USA,"Also released under the title Like a Crow on a June Bug, this film follows the adventures that befall a rural country girl when she is enchanted by the promise of excitement that the wide world holds."
Adult,Adolescence Pervertie,Adolescence Pervertie (1974),5,Adult,,,,,"France, Italy",
Adult,Sechs Schwedinnen Von Der Tankstelle,Sechs Schwedinnen Von Der Tankstelle (1980),5,Adult,,,"business, customer, entrepreneur, jealousy, mayor",,Switzerland,"The Swedish sex comedy Sechs Schwedinnen Von Der Tankstelle centers on a half-dozen attractive woman who become major figures in their town when they start their own business. They engage in a number of behaviors above and beyond the call of duty in order to keep their customers returning time and time again. They end up becoming enemies with the mayor's wife, whose dislike of the group may stem more from jealousy than anything else."
Adult,Education Anglaise,Education Anglaise (1982),5,Adult,,,,,France,
Adult,The Touchables,The Touchables (1961),5,Adult,Softcore Sex Film,Out For Revenge,"accounting, bachelor, gangster, on-the-run",,USA,"The Touchables is an undistinguished, soft-core film with a thin plot to string together various nude scenes into an approximate story. At the center of the action is an accountant hiding out in a dubious-looking female spa. He blew the whistle on some gangsters for tax evasion, and now they want to get even. As the accountant is chased and fumbles around in the sauna and swimming pool and work-out room, females in various stages of undress are always around. Since the setting is supposedly 1932, the women manage to keep the lower half of a bikini on, which is interesting considering the bathing suits of that time."
Adult,Lulu,Lulu (1980),5,Adult,Sex Horror,,"artist, editor, Jack-the-Ripper, nymphomaniac",,"France, Germany, Italy, West Germany","Based on stories by Frank Wedekind, this undistinguished erotic film recounts the sexual exploits of free-spirited Lulu (Ann Bennent) as she goes from one lover to the next. First she becomes involved with an artist and then eventually with an important editor (Heinz Bennent) who unsuccessfully tries to get out of her clutches. Lulu's biggest mistake is to be in London just when Jack the Ripper is making his scalpel-wielding presence known among the prostitutes of that city."
Adult,Garage Sale,Garage Sale (1976),5,Adult,Biopic [feature],,"drag-queen, marriage",,USA,"The adventures of full-time drag-queen ""Goldie Glitters"" are chronicled in this completely independent film, which includes a small amount of hardcore pornography. Most of the humor derives from the marriage between Miss Glitters (Michael Hessy) and his/her extremely conventional beau, called Hero (Tom White)."
Adult,The Passions of Carol,The Passions of Carol (1975),5,Adult,,,,,USA,
Adult,Fireworks Woman,Fireworks Woman (1975),5,Adult,,,,,USA,
Adult,Story of the Dolls,Story of the Dolls (1983),5,Adult,Softcore Sex Film,,"city-life, modeling",,"Hong Kong, West Germany","This softporn film features the body of Tetchie Agbayani (who gained recognition after a German Playboy layout) in various erotic and sexual acts, strung together by a thin story about her leaving the Philippine countryside to model in the big city and then finding out she really belongs back home again."
Adult,Virgin People,Virgin People (1983),5,Adult,Softcore Sex Film,,"escapades, sex, virgin",,Philippines,"This softporn Philippine movie begins with three virgins in a remote village who are given over to the experiences of wanton lovemaking when a good-looking young man and an uncle with a lecherous bent visit their village. While this movie scored high in the Philippine venues when it was released in 1983, viewers may differ in their opinions of its erotic and artistic value."
Adult,Luxure,Luxure (1976),5,Adult,,,,,France,
Adult,Les Maitresses De Vacances,Les Maitresses De Vacances (1974),5,Adult,,,,,France,
Adult,La Nuit Des Petrifies,La Nuit Des Petrifies (1972),5,Adult,,,,,France,
Adult,Les Petites Saintes Y Touchent,Les Petites Saintes Y Touchent (1974),5,Adult,,,,,France,
Adult,Piege A Pucelles,Piege A Pucelles (1972),5,Adult,,,,,France,
Adult,Pigalle Carrefour Des Illusions,Pigalle Carrefour Des Illusions (1972),5,Adult,,,,,France,
Adult,Marilyn and the Senator,Marilyn and the Senator (1975),5,Adult,,,"agent [representative], father, marriage-trap, parent, pregnancy, Senator, sex",,USA,"In this softcore porn film, three women, including a murderous CIA agent, seek to bear the child of a glamorous U.S. Senator. At first he cannot bed the women, because they make their intentions known to him and he deeply fears fatherhood. They are all apparently successfully impregnated when the women decide to pretend to him that they really don't want children. Then the CIA agent decides that she wants sole possession of the senator."
Adult,Femmes,Femmes (1983),5,Adult,Softcore Sex Film,Playing the Field,"bachelor, escapades, nymphomaniac, sex",,France,"Boring sex dominates this softporn (or for some people, merely erotic nonstory) about a nymphomaniac male who lands on a tropical island and like a dog in mating season, goes after every leg in sight. He restarts a sexual relationship with an old lover, starts a new sexual relationship with her daughter, and starts a bisexual relationship with a lesbian couple -- the last and final frontier in this film."
Adult,The Game Is Sex,The Game Is Sex (1969),5,Adult,,,"bachelor, mistress, secretary, television, vacation, writing",,USA,"Andre (Michael Canavan) is the television writer who has an argument with his mistress Irene (Irene Rosetti). When she pouts because she can't have her way, Irene takes off on an early vacation. Andre's secretary Nancy (Susana March) is more than willing to take Irene's place in bed in this erotic exploitation film. Many of London's most swinging sex clubs are featured."
Adult,Monzetsu: Donden Gaeshi,Monzetsu: Donden Gaeshi (1976),5,Adult,Softcore Sex Film,,"college, rape, revenge, student, waiter",,Japan,"Japan's famed Nikkatsu studios held a screenwriting contest and made this film from the winning entry, originally titled Azuki-Iro No Tasogare. Director Tatsumi Kumashiro, who made the bloody cult favorite Jigoku for the rival Toei studio two years later, does his best with the overripe tale of a college coed (pinku-eiga legend Naomi Tani) paying her way through school as a B-girl. As in countless other roughies of the time, the sexual hijinks soon deteriorate into sadistic rape and the young woman's violent revenge."
Adult,La Maison Des Confidences,La Maison Des Confidences (1974),5,Adult,,,,,France,
Adult,La Maison des Filles Perdues,La Maison des Filles Perdues (1974),5,Adult,,,,,"France, Italy",
Adult,I.K.U.,I.K.U. (2000),5,Science Fiction,Softcore Sex Film,Head Trips,"cyborg, robot, cybernetics, sex, bizarre",,Japan,"Taiwanese-born experimental filmmaker Shu Lea Cheang directs this dizzying computer-enhanced sci-fi cyber-porn flick. A pun that roughly translates from Japanese as ""I'm coming!"", the title aptly sets the film's orgasmic tone. The story, as such, revolves around the GENOM Corporation, which has started mass-producing sexbots for the lofty purpose of bettering humankind's sexual development. Reiko (Tokitoh Ayumu) is one such cyborg; her body being one giant ""Gen-XXX IKU Coder"" hard drive, she is burdened with the task of collecting ""orgasm data"" by shagging everything that moves. Set against some brilliantly bizarre digitally-animated set pieces, the film's characters couple, triple, and so forth with remarkable indifference to gender, species, or physiological make-up. This film was screened at the 2000 Sundance Film Festival."
Adult,The Female Bunch,The Female Bunch (1969),5,Action,Adventure Drama,,"battle-of-the-sexes, border [geographic], drugs, exploitation, group, handsome, hired-hand, man, man-hater, Mexico, ranch, settler, sex, stranger, woman",,USA,"An utterly bizarre psychedelic exploitation-western, The Female Bunch tells the tale of five women who live on a ranch with no men. Russ Tamblyn can be seen having his face branded before being impaled with a pitchfork; there are scenes of lesbianism and drug use; and a rather haggard Lon Chaney, Jr. appears as a ranchhand in his final role before his death in 1973. One of the strangest films directed by cult filmmaker Al Adamson (Satan's Sadists), this low-budget oddity was shot at the Spahn Movie Ranch at the time that it was occupied by the Manson Family."
Adult,Laure,Laure (1975),5,Adult,Softcore Sex Film,,"bachelorette, extramarital-affair, love, romance, sex",,"France, Italy","This Italian-French co-production is not technically an ""Emmanuelle"" film, even though it stars that series' inspiration, Emmanuelle Arsan, and was based on one of her stories. Instead, this soft-core jungle adventure focuses on Laure (Annie Belle from La Casa Sperduta nel Parco), a priest's daughter who joins Orso Maria Guerrini's expedition to the Philippines to study the Mara tribe's rebirth ritual. What she studies instead are the male and female anatomies of her cohorts, including anthropologist Arsan and filmmaker Pier Luigi Conti, appearing under his usual pseudonym, Al Cliver. Cinematographer Roberto d'Ettore Piazzoli had worked with director Ovidio G. Assonitis the year before on the Exorcist rip-off Behind the Door, starring Piazzoli's wife Juliet Mills, ."
Adult,Hollywood Hot Tubs,Hollywood Hot Tubs (1984),5,Adult,Softcore Sex Film,,"co-worker, Hollywood, hot-tub, plumber, celebrity",,USA,"In yet another mindless teen sex comedy, a young man gets a job repairing hot tubs for the rich and famous in Tinseltown, thanks to his parents. As he moves from one bubbly tub to the next, sexual situations change accordingly, but a romance between the young man and a co-worker at the hot tub establishment heats up as they get into hot water together."
Adult,Sugar Cookies,Sugar Cookies (1973),5,Adult,Erotic Thriller,"Out For Revenge,Filmmaking,Dangerous Attraction","actor, film-director, lookalike, murder, seduction, pornography",,USA,"A twisted sexual power-trip game goes too far, and adult film director Max Vavell (George Shannon) causes the violent death of his leading lady, Alta Lee (Lynn Lowry). The motion picture community is convinced that she took her own life, though Max's casting agent Camilla (Mary Woronov) knows better. Camilla and Alta had been lovers in the past, so she secretly plots an elaborate revenge. After auditioning dozens of would-be actresses, Camilla discovers a perfect lookalike for Alta in the naive, inexperienced Julie (also played by Lynn Lowry). She takes the fledgling starlet under her wing, buying her clothes, giving her acting tips, and eventually seducing her. Julie falls in love and is completely dominated by the strong-willed Camilla, who dresses her in Alta's clothes and turns Max's dark fantasies against him in a deadly freak scene. Sugar Cookies was an early production credit for both Oscar-winner Oliver Stone and Troma Entertainment honcho Lloyd Kaufman, and features supporting roles from cult figures Monique van Vooren, Ondineand Jennifer Welles."
Adult,Seduction: The Cruel Woman,Seduction: The Cruel Woman (1985),5,Adult,Softcore Sex Film,"Self-Destructive Romance,Prostitutes","domination  [sexual], sadomasochism, sex, art-gallery, Germany, seduction, woman",,West Germany,"A leitmotif of masochism and sado-masochism forms the pivot around which the sexual encounters in this banal erotic film turn, and turn, and turn. (This content was the controversial reason the two co-directors were refused a government subsidy for their work.) Wanda is a dominatrix who lures men and women of all types into her sado-masochistic world of sex, and as these encounters occur, there is no inciteful accompanying dialogue that might point to politics or philosophy or whatever as a subtext. Perhaps that is the message, and perhaps there is no message."
Adult,The Opening of Misty Beethoven,The Opening of Misty Beethoven (1976),5,Adult,Hardcore Sex Film,"Sexual Awakening,Prostitutes","education, prostitute/prostitution, sex, sex-education, writing",,USA,"The director of The Afternoons of Pamela Mann--and several other successful marriages of hardcore pornography and storytelling--here attempts to show the sexual education of a naive new prostitute under the direction of a satiated, bored writer."
Adult,Nightdreams,Nightdreams (1981),5,Adult,,,,,USA,
Adult,Panty Raid,Panty Raid (1983),5,Adult,,,,,,
Adult,Nana,Nana (1970),5,Adult,Softcore Sex Film,,"prostitute/prostitution, sex",,Sweden,"Even extensive nudity and sexual situations didn't make the hammy acting in this period drama acceptable to its opening night audience in Sweden, and they walked out in large numbers early on in the film. However, this adaptation of Emile Zola's 19th-century classic novel ""Nana,"" about the sexual liaisons of a French courtesan, features an attractive and even humorous performance by the well-proportioned actress Anna Gael. While not particularly pornographic, this film earned an ""X"" rating for its American release."
Adult,Defiance,Defiance (1974),5,Adult,,,,,USA,
Adult,The Mount of Venus,The Mount of Venus (1975),5,Adult,,,,,USA,
Adult,ï¿½ Propos De La Femme,À Propos De La Femme (1969),5,Adult,,,,,France,
Adult,La Bete A Plaisir,La Bete A Plaisir (1974),5,Adult,,,,,France,
Adult,Black Love,Black Love (1974),5,Adult,Erotic Thriller,,,,France,
Adult,Un Chant d'amour,Un Chant d'amour (1950),5,Adult,Gay & Lesbian Films,,,,France,"Jean Genet, the novelist, playwright, political activist and gadfly who became a (literal) outlaw literary hero in France, directed his first and only film in this notorious silent short subject. Set in a French prison, Un Chant D'amour explores the crushing loneliness and thwarted desires of men behind bars, as well as the sadistic impulses of the men who look after them. Two prisoners whose cells are next to one another are desperate to make contact, but the Morse code they tap on the walls and the cigarette smoke they blow through straws are as close as they can come to human interaction. As the men lose themselves in homoerotic fantasy and self gratification, a guard watches their actions though a series of peep holes, and chooses to sadistically beat one of his charges, who uses his daydreams to escape the pain. Featuring a great deal of nudity and explicit sexual content (especially for a film made in 1950), Un Chant D'amour was originally intended to be sold only among collectors of erotica, and its few public screenings in the 1950's and early 60's led to it being declared obscene in France and the United States. After standards for motion picture content became more lenient in the 1970's, the film was occasionally revived at art houses, though Genet spoke negatively of it later in his life."
Adult,Les Chiennes,Les Chiennes (1972),5,Adult,,,,,France,
Adult,Club Prive Pour Couples Avertis,Club Prive Pour Couples Avertis (1973),5,Adult,,,,,France,
Adult,Comment Le Desir Vient Aux Filles,Comment Le Desir Vient Aux Filles (1972),5,Adult,,,,,France,
Adult,Les Confidences Erotiques D'Un Lit Trop Accueillant,Les Confidences Erotiques D'Un Lit Trop Accueillant (1973),5,Adult,,,,,France,
Adult,Desirella,Desirella (1970),5,Adult,,,,,France,
Adult,En Amour Ca Va Ca Vient,En Amour Ca Va Ca Vient (1974),5,Adult,,,,,France,
